{
  "$schema": "http://json-schema.org/draft-07/schema#",
  "$id": "https://example.com/schemas/n8n-workflow.schema.json",
  "title": "n8n Workflow",
  "type": "object",
  "required": ["nodes", "connections", "active", "settings", "meta", "version"],
  "additionalProperties": false,
  "properties": {
    "nodes": {
      "type": "array",
      "minItems": 1,
      "items": { "$ref": "#/definitions/node" }
    },
    "connections": {
      "type": "object",
      "minProperties": 1,
      "additionalProperties": { "$ref": "#/definitions/connectionMap" }
    },
    "active": { "type": "boolean" },
    "settings": {
      "type": "object",
      "additionalProperties": false
    },
    "meta": {
      "type": "object",
      "additionalProperties": true
    },
    "version": {
      "type": "integer",
      "minimum": 0
    }
  },
  "definitions": {
    "node": {
      "type": "object",
      "required": ["id", "name", "type", "position", "parameters"],
      "additionalProperties": false,
      "properties": {
        "id": {
          "type": "string",
          "pattern": "^[A-Za-z0-9_-]+$"
        },
        "name": {
          "type": "string",
          "minLength": 1
        },
        "type": {
          "type": "string",
          "enum": [
            "n8n-nodes-base.httpRequest",
            "n8n-nodes-base.set",
            "n8n-nodes-base.if",
            "n8n-nodes-base.function",
            "n8n-nodes-base.googleSheets",
            "n8n-nodes-base.openAi",
            "n8n-nodes-base.webhook"
          ]
        },
        "position": {
          "type": "object",
          "required": ["x", "y"],
          "additionalProperties": false,
          "properties": {
            "x": { "type": "number" },
            "y": { "type": "number" }
          }
        },
        "parameters": {
          "type": "object",
          "additionalProperties": true
        },
        "credentials": {
          "type": "object",
          "minProperties": 1,
          "additionalProperties": false,
          "patternProperties": {
            "^[A-Za-z0-9_-]+$": {
              "oneOf": [
                {
                  "type": "string",
                  "pattern": "^\\\\{\\\\{CREDENTIALS\\.[A-Z0-9_]+\\\\}\\\\}$"
                },
                {
                  "type": "string",
                  "pattern": "^\\{\\{CREDENTIALS\\.[A-Z0-9_]+\\}\\}$"
                }
              ]
            }
          }
        },
        "notes": {
          "type": "string"
        }
      }
    },
    "connectionMap": {
      "type": "object",
      "required": ["main"],
      "additionalProperties": false,
      "properties": {
        "main": {
          "type": "array",
          "items": {
            "type": "array",
            "items": { "$ref": "#/definitions/connection" }
          }
        }
      }
    },
    "connection": {
      "type": "object",
      "required": ["node", "type", "index"],
      "additionalProperties": false,
      "properties": {
        "node": { "type": "string", "minLength": 1 },
        "type": { "type": "string", "enum": ["main"] },
        "index": { "type": "integer", "minimum": 0 }
      }
    }
  }
}
